{
  "v": 1,
  "id": "020-fabrik-v0-2-0",
  "title": "Fabrik v0.2.0 TS parity and standalone binary",
  "status": "draft",
  "version": "0.2.0",
  "lastUpdated": "2026-02-02",
  "supersedes": [],
  "dependsOn": [],
  "goals": [
    "Implement TypeScript equivalents for all core CLI workflows",
    "Remove bash script dependency from fabrik commands",
    "Ensure standalone binary embeds all required assets",
    "Add LAOS + credentials commands with robust prereq checks",
    "Prepare for v0.2.0 release readiness"
  ],
  "nonGoals": [
    "Change VM provisioning implementation",
    "Rewrite Smithers workflows",
    "Add new orchestration features beyond parity"
  ],
  "req": {
    "api": [
      "fabrik run/fleet/cleanup/feedback use TS implementations",
      "fabrik laos uses jj with git fallback",
      "fabrik credentials sync mirrors shell behavior"
    ],
    "behavior": [
      "Standalone binary works without local repo checkout",
      "Errors are explicit and actionable",
      "All commands remain backward compatible"
    ],
    "obs": [
      "Record audit metadata in run DB (CLI version, OS, hash)",
      "Log external command failures with context"
    ]
  },
  "cfg": {
    "env": [
      "LOCAL_RALPH_HOME",
      "RALPH_AGENT",
      "MAX_ITERATIONS"
    ]
  },
  "accept": [
    "All tasks in todo.json completed and verified",
    "fabrik binary runs from embedded assets on fresh machine",
    "No bash scripts required for fabrik commands",
    "v0.2.0 release readiness checks pass"
  ],
  "assume": [
    "VMs exist and are reachable",
    "Smithers is installed in VM base image",
    "Host has docker/limactl/virsh as needed"
  ]
}
